location,metric,winery,country,lat,lon
"A. de Luze et Fils winery ,Bordeaux Blanc, Bordeaux, France",0.43333333333333335,A. de Luze et Fils,France,44.837789,-0.57918
"Albert Bichot winery ,Crémant de Bourgogne, Burgundy, France",0.546590909090909,Albert Bichot,France,47.0525047,4.3837215
"Alliance Loire winery ,Cabernet d'Anjou, Loire Valley, France",0.5625,Alliance Loire,France,47.19824200000001,-0.07275899999999999
"Alpha Loire winery ,Touraine, Loire Valley, France",0.4541666666666667,Alpha Loire,France,47.4177598,1.0230294
"Alter Ego de Palmer winery ,Margaux, Bordeaux, France",0.41547619047619044,Alter Ego de Palmer,France,45.0360184,-0.6687479
"Andre et Mireille Tissot winery ,Crémant de Jura, France Other, France",0.7,Andre et Mireille Tissot,France,46.9249439,5.7793208
"Antoine et Rachel Olivier winery ,Bourgogne, Burgundy, France",0.5958333333333333,Antoine et Rachel Olivier,France,46.9139559,4.683945899999999
"Barton & Guestier winery ,Côtes de Gascogne, Southwest France, France",0.43333333333333335,Barton & Guestier,France,36.0704751,-95.9203639
"Barton & Guestier winery ,Muscadet Sèvre et Maine, Loire Valley, France",0.48047619047619056,Barton & Guestier,France,36.0704751,-95.9203639
"Barton & Guestier winery ,Sancerre, Loire Valley, France",0.41047619047619044,Barton & Guestier,France,36.0704751,-95.9203639
"Belles Vignes winery ,Vin de France, France Other, France",0.4699494949494949,Belles Vignes,France,,
"Benjamin Leroux winery ,Auxey-Duresses, Burgundy, France",0.5507142857142857,Benjamin Leroux,France,47.0252104,4.8452087
"Bernard Magrez winery ,Bordeaux Rosé, Bordeaux, France",0.6,Bernard Magrez,France,44.8059991,-0.6474262
"Bernard Reverdy et Fils winery ,Sancerre, Loire Valley, France",0.4126984126984127,Bernard Reverdy et Fils,France,47.3532269,2.8160611
"Bernard et Christophe Richel winery ,Vin de Savoie, France Other, France",0.4335974025974026,Bernard et Christophe Richel,France,45.4932045,6.472399999999999
"Blason de Bourgogne winery ,Mâcon-Villages, Burgundy, France",0.45000000000000007,Blason de Bourgogne,France,46.3068839,4.828730999999999
"Bouchard Père & Fils winery ,Clos de Vougeot, Burgundy, France",0.46071428571428563,Bouchard Père & Fils,France,,
"Bouchard Père & Fils winery ,Corton-Charlemagne, Burgundy, France",0.5,Bouchard Père & Fils,France,,
"Bret Brothers winery ,Mâcon-Villages, Burgundy, France",0.5200000000000001,Bret Brothers,France,46.2705001,4.7649238
"Bret Brothers winery ,Pouilly-Loché, Burgundy, France",0.412363315696649,Bret Brothers,France,46.2705001,4.7649238
"Brotte winery ,Côtes du Rhône, Rhône Valley, France",0.5,Brotte,France,44.054065,4.834646
"Cap Royal winery ,Bordeaux Blanc, Bordeaux, France",0.5430555555555556,Cap Royal,France,44.837789,-0.57918
"Caspen winery ,Vin de Pays des Côtes Catalanes, Languedoc-Roussillon, France",0.55,Caspen,France,43.5912356,3.2583626
"Cave des Grands Crus Blancs winery ,Mâcon Chaintré, Burgundy, France",0.75,Cave des Grands Crus Blancs,France,46.2739122,4.7775884
"Caves de Rauzan winery ,Bordeaux Rosé, Bordeaux, France",0.4143939393939393,Caves de Rauzan,France,44.7785778,-0.1163673
"Chai de Bordes winery ,Bordeaux Blanc, Bordeaux, France",0.47500000000000003,Chai de Bordes,France,44.8803799,-0.5483718
"Chais de Méribel winery ,Sauternes, Bordeaux, France",0.425,Chais de Méribel,France,45.396839,6.566576
"Chantebelle winery ,Côtes de Gascogne, Southwest France, France",0.41250000000000003,Chantebelle,France,,
"Charles Duret winery ,Crémant de Bourgogne, Burgundy, France",0.44375,Charles Duret,France,47.0525047,4.3837215
"Chatelain Desjacques winery ,Val de Loire, Loire Valley, France",0.4166666666666667,Chatelain Desjacques,France,47.5532402,1.0105289
"Château Beauregard-Ducourt winery ,Bordeaux Rosé, Bordeaux, France",0.625,Château Beauregard-Ducourt,France,44.9227498,-0.2019154
"Château Bois Malot winery ,Bordeaux Blanc, Bordeaux, France",0.425,Château Bois Malot,France,44.94524029999999,-0.4553259999999999
"Château Bois de Rolland winery ,Bordeaux Blanc, Bordeaux, France",0.4151785714285714,Château Bois de Rolland,France,44.837789,-0.57918
"Château Bonfort winery ,Montagne-Saint-Émilion, Bordeaux, France",0.5333333333333333,Château Bonfort,France,44.93028530000001,-0.1301373
"Château Bonnet winery ,Bordeaux Rosé, Bordeaux, France",0.43124999999999997,Château Bonnet,France,44.8434429,-0.5742259
"Château Bousquette winery ,Saint-Chinian, Languedoc-Roussillon, France",0.41111111111111115,Château Bousquette,France,43.421143,2.9300069
"Château Carignan winery ,Bordeaux Blanc, Bordeaux, France",0.6750000000000002,Château Carignan,France,44.8101959,-0.4654749
"Château Caville winery ,Bordeaux, Bordeaux, France",0.42500000000000004,Château Caville,France,44.837789,-0.57918
"Château Coussin winery ,Mediterranée, France Other, France",0.4375,Château Coussin,France,43.4765715,5.6770044
"Château Coutet Saint-Emilion winery ,Saint-Émilion, Bordeaux, France",0.575,Château Coutet Saint-Emilion,France,44.8980197,-0.1739658
"Château Crusquet Sabourin winery ,Blaye Côtes de Bordeaux, Bordeaux, France",0.43333333333333335,Château Crusquet Sabourin,France,45.1285865,-0.619813
"Château Ducla winery ,Bordeaux Blanc, Bordeaux, France",0.5775,Château Ducla,France,44.5893001,-0.0888621
"Château Fontenelle winery ,Blaye Côtes de Bordeaux, Bordeaux, France",0.48333333333333334,Château Fontenelle,France,44.837789,-0.57918
"Château Gabaron winery ,Bordeaux, Bordeaux, France",0.43333333333333335,Château Gabaron,France,44.837789,-0.57918
"Château Gairoird winery ,Côtes de Provence, Provence, France",0.43194444444444446,Château Gairoird,France,43.243789,6.090387
"Château Godard winery ,Francs Côtes de Bordeaux, Bordeaux, France",0.7,Château Godard,France,44.936027,-0.0114817
"Château Gromel Bel Air winery ,Bordeaux Supérieur, Bordeaux, France",0.55,Château Gromel Bel Air,France,44.837789,-0.57918
"Château Haut Ballet winery ,Fronsac, Bordeaux, France",0.575,Château Haut Ballet,France,44.924318,-0.2712629
"Château Haut Bertinerie winery ,Côtes de Bordeaux, Bordeaux, France",0.41874999999999996,Château Haut Bertinerie,France,45.0756231,-0.4129743
"Château Haut Canteloup winery ,Blaye Côtes de Bordeaux, Bordeaux, France",0.43888888888888894,Château Haut Canteloup,France,45.17188669999999,-0.6335061
"Château Haut Claribes winery ,Bordeaux, Bordeaux, France",0.47857142857142865,Château Haut Claribes,France,44.8166517,-0.6086119
"Château Haut Grand Champ winery ,Bordeaux Blanc, Bordeaux, France",0.4083333333333333,Château Haut Grand Champ,France,44.837789,-0.57918
"Château Haut Mondain winery ,Bordeaux Blanc, Bordeaux, France",0.4333189033189033,Château Haut Mondain,France,44.837789,-0.57918
"Château Haut Pasquet winery ,Bordeaux, Bordeaux, France",0.4166666666666667,Château Haut Pasquet,France,44.8166517,-0.6086119
"Château Haut-Carles winery ,Fronsac, Bordeaux, France",0.4777777777777777,Château Haut-Carles,France,44.83387,-0.5661700000000001
"Château L'Escadre winery ,Blaye Côtes de Bordeaux, Bordeaux, France",0.526388888888889,Château L'Escadre,France,45.1243501,-0.615243
"Château La Jalgue winery ,Bordeaux, Bordeaux, France",0.6083333333333334,Château La Jalgue,France,44.8362763,-0.5716164
"Château La Lagune winery ,Haut-Médoc, Bordeaux, France",0.4166666666666667,Château La Lagune,France,44.9783464,-0.6174332
"Château La Rame winery ,Saint-Croix-du-Mont, Bordeaux, France",0.4133333333333334,Château La Rame,France,44.5910755,-0.2733347
"Château La Roche Bazin winery ,Blaye Côtes de Bordeaux, Bordeaux, France",0.428125,Château La Roche Bazin,France,44.837789,-0.57918
"Château Lamothe Castera winery ,Bordeaux, Bordeaux, France",0.4171428571428571,Château Lamothe Castera,France,44.837789,-0.57918
"Château Landereau winery ,Entre-Deux-Mers, Bordeaux, France",0.4463541666666667,Château Landereau,France,44.8002901,-0.3899806
"Château Laubes winery ,Bordeaux, Bordeaux, France",0.4142857142857143,Château Laubes,France,44.8362763,-0.5716164
"Château Laville winery ,Bordeaux Rosé, Bordeaux, France",0.53125,Château Laville,France,44.837789,-0.57918
"Château Le Giron winery ,Bordeaux Blanc, Bordeaux, France",0.4666666666666666,Château Le Giron,France,44.837789,-0.57918
"Château Les Hauts de Palette winery ,Bordeaux Rosé, Bordeaux, France",0.44571428571428573,Château Les Hauts de Palette,France,44.825274,-0.551067
"Château Léo de Prades winery ,Saint-Estèphe, Bordeaux, France",0.42666666666666664,Château Léo de Prades,France,45.249681,-0.786858
"Château Léon winery ,Bordeaux Rosé, Bordeaux, France",0.7333333333333334,Château Léon,France,44.837789,-0.57918
"Château Léoube winery ,Vin Mousseux, France Other, France",0.4132996632996633,Château Léoube,France,43.1214995,6.2933626
"Château Marbuzet winery ,Saint-Estèphe, Bordeaux, France",0.575,Château Marbuzet,France,45.2383114,-0.7696195
"Château Mazails winery ,Médoc, Bordeaux, France",0.4083333333333333,Château Mazails,France,44.8623025,-0.550103
"Château Merlet winery ,Bordeaux Blanc, Bordeaux, France",0.41948051948051945,Château Merlet,France,44.837789,-0.57918
"Château Moncabrier winery ,Bordeaux Supérieur, Bordeaux, France",0.5375,Château Moncabrier,France,44.5416839,1.07365
"Château Nardou winery ,Francs Côtes de Bordeaux, Bordeaux, France",0.4091666666666667,Château Nardou,France,44.953604,-0.024697
"Château Naudeau winery ,Entre-Deux-Mers, Bordeaux, France",0.5,Château Naudeau,France,44.837789,-0.57918
"Château Penin winery ,Bordeaux Clairet, Bordeaux, France",0.5,Château Penin,France,44.8623025,-0.550103
"Château Philippe-le-Hardi winery ,Bourgogne Hautes Côtes de Beaune, Burgundy, France",0.4227813852813853,Château Philippe-le-Hardi,France,47.01346580000001,4.815776100000001
"Château Platon winery ,Bordeaux Blanc, Bordeaux, France",0.4625,Château Platon,France,44.837789,-0.57918
"Château Péby Faugères winery ,Saint-Émilion, Bordeaux, France",0.45752164502164494,Château Péby Faugères,France,44.8789319,-0.0792763
"Château Rauzan Despagne winery ,Bordeaux Blanc, Bordeaux, France",0.5083333333333333,Château Rauzan Despagne,France,44.837789,-0.57918
"Château Raymond-Lafon winery ,Sauternes, Bordeaux, France",0.4409722222222222,Château Raymond-Lafon,France,44.5501044,-0.3298745
"Château Recougne winery ,Bordeaux Blanc, Bordeaux, France",0.41420454545454544,Château Recougne,France,44.837789,-0.57918
"Château Roc de Levraut winery ,Bordeaux Supérieur, Bordeaux, France",0.41875000000000007,Château Roc de Levraut,France,44.837789,-0.57918
"Château Roland-La-Garde winery ,Blaye Côtes de Bordeaux, Bordeaux, France",0.40909090909090906,Château Roland-La-Garde,France,45.1529227,-0.6307522999999999
"Château Roquevieille winery ,Côtes de Castillon, Bordeaux, France",0.6285714285714286,Château Roquevieille,France,44.837789,-0.57918
"Château Saint-Germain winery ,Bordeaux, Bordeaux, France",0.4375,Château Saint-Germain,France,44.8362763,-0.5716164
"Château Sainte-Marguerite winery ,Côtes de Provence, Provence, France",0.42708333333333337,Château Sainte-Marguerite,France,43.1509381,6.249895599999999
"Château Suau winery ,Bordeaux Rosé, Bordeaux, France",0.44039772727272725,Château Suau,France,44.6945561,-0.3244717
"Château Suau winery ,Côtes de Bordeaux, Bordeaux, France",0.47250000000000003,Château Suau,France,44.6945561,-0.3244717
"Château Tour de Guiet winery ,Bordeaux Supérieur, Bordeaux, France",0.4166666666666667,Château Tour de Guiet,France,44.837789,-0.57918
"Château Tour le Pin winery ,Bordeaux Blanc, Bordeaux, France",0.645,Château Tour le Pin,France,45.564026,5.445327
"Château Turcaud winery ,Bordeaux Blanc, Bordeaux, France",0.40819444444444447,Château Turcaud,France,44.751161,-0.3129546
"Château Val d'Arenc winery ,Bandol, Provence, France",0.5044444444444444,Château Val d'Arenc,France,43.1694358,5.7939322
"Château Valcolombe winery ,Coteaux Varois en Provence, Provence, France",0.6633333333333333,Château Valcolombe,France,43.393839,6.0407464
"Château d'Aydie winery ,nan, Southwest France, France",0.4704761904761904,Château d'Aydie,France,43.569457,-0.104667
"Château d'Yquem winery ,Sauternes, Bordeaux, France",0.41994047619047625,Château d'Yquem,France,44.544703,-0.328734
"Château de Bel winery ,Vin de France, France Other, France",0.48888888888888893,Château de Bel,France,44.715818,-0.609204
"Château de Bellevue winery ,Bordeaux Blanc, Bordeaux, France",0.4200000000000001,Château de Bellevue,France,44.837789,-0.57918
"Château de Berne winery ,Mediterranée, France Other, France",0.4333333333333334,Château de Berne,France,43.5148575,6.365700100000001
"Château de Brigue winery ,Vin Mousseux, France Other, France",0.4166666666666667,Château de Brigue,France,43.392767,6.311889
"Château de Béru winery ,Chablis, Burgundy, France",0.5,Château de Béru,France,47.80098,3.8880033
"Château de Cordes winery ,Minervois, Languedoc-Roussillon, France",0.5,Château de Cordes,France,43.2837865,2.5861001
"Château de Fesles winery ,Bonnezeaux, Loire Valley, France",0.4160714285714286,Château de Fesles,France,47.264546,-0.470306
"Château de Fontenille winery ,Bordeaux Rosé, Bordeaux, France",0.6749999999999999,Château de Fontenille,France,44.7624018,-0.3264872
"Château de Gaudou winery ,Vin Mousseux, France Other, France",0.55,Château de Gaudou,France,44.483639,1.104329
"Château de Lagarde winery ,Bordeaux Blanc, Bordeaux, France",0.44000000000000006,Château de Lagarde,France,44.837789,-0.57918
"Château de Léoube winery ,Côtes de Provence, Provence, France",0.4583333333333333,Château de Léoube,France,43.1214995,6.2933626
"Château de Marsan winery ,Bordeaux Rosé, Bordeaux, France",0.4426020408163266,Château de Marsan,France,43.6556591,0.7212179000000001
"Château de Nardon winery ,Bordeaux Supérieur, Bordeaux, France",1.0,Château de Nardon,France,44.837789,-0.57918
"Château de Pierreclos winery ,Pouilly-Fuissé, Burgundy, France",0.4928571428571428,Château de Pierreclos,France,46.33,4.6863889
"Château de Pitray winery ,Castillon Côtes de Bordeaux, Bordeaux, France",0.7166666666666667,Château de Pitray,France,44.8998207,-0.0275128
"Château de Ribebon winery ,Bordeaux Supérieur, Bordeaux, France",0.43124999999999997,Château de Ribebon,France,44.837789,-0.57918
"Château de Roquefort winery ,Côtes de Provence, Provence, France",0.5427083333333333,Château de Roquefort,France,43.2510815,5.636380099999999
"Château de Tigné winery ,Vin de France, France Other, France",0.5041666666666668,Château de Tigné,France,47.1988257,-0.4276038
"Château de l'Aubrade winery ,Bordeaux Rosé, Bordeaux, France",0.40787121212121213,Château de l'Aubrade,France,44.680904,0.011487
"Château de la Crée winery ,Meursault, Burgundy, France",0.46875,Château de la Crée,France,46.9147949,4.6868397
"Château de la Liquiere winery ,Faugères, Languedoc-Roussillon, France",0.44499999999999995,Château de la Liquiere,France,43.530126,3.140815
"Château de la Rivière winery ,Bordeaux Blanc, Bordeaux, France",0.4766666666666666,Château de la Rivière,France,44.943096,-0.318262
"Château de la Roulerie winery ,Coteaux du Layon, Loire Valley, France",0.6000000000000001,Château de la Roulerie,France,47.326709,-0.6580271
"Château des Pertonnières winery ,Beaujolais, Beaujolais, France",0.44285714285714284,Château des Pertonnières,France,45.8933378,4.5889841
"Château du Cros winery ,nan, Bordeaux, France",0.5683333333333334,Château du Cros,France,44.8623025,-0.550103
"Château du Grand Pierre winery ,Blaye Côtes de Bordeaux, Bordeaux, France",0.41416666666666674,Château du Grand Pierre,France,44.837789,-0.57918
"Château du Juge winery ,Cadillac Côtes de Bordeaux, Bordeaux, France",0.41805555555555557,Château du Juge,France,44.64566620000001,-0.3057282
"Château du Pin Franc winery ,Bordeaux, Bordeaux, France",0.5083333333333334,Château du Pin Franc,France,45.05223549999999,-0.4743802
"Château la Coustarelle winery ,Cahors, Southwest France, France",0.5333333333333333,Château la Coustarelle,France,44.4825373,1.1861801
"Château la Freynelle winery ,Bordeaux Rosé, Bordeaux, France",0.5166666666666667,Château la Freynelle,France,44.7948967,-0.2204773
"Château la Grave winery ,Minervois, Languedoc-Roussillon, France",0.4916666666666667,Château la Grave,France,43.20842649999999,2.4913677
"Château la Grâce Dieu winery ,Saint-Émilion, Bordeaux, France",0.45999999999999996,Château la Grâce Dieu,France,44.9076049,-0.1774535
"Château la Marzelle winery ,Saint-Émilion, Bordeaux, France",0.5343253968253968,Château la Marzelle,France,44.9083964,-0.1916198
"Château la Rayre winery ,Monbazillac, Southwest France, France",0.725,Château la Rayre,France,44.7735514,0.5065472
"Château la Rose du Pin winery ,Bordeaux, Bordeaux, France",0.4544642857142857,Château la Rose du Pin,France,44.8624022,-0.5506215
"Château la Varière winery ,Coteaux du Layon, Loire Valley, France",0.575,Château la Varière,France,47.3520619,-0.4569136999999999
"Château le Grand Verdus winery ,Bordeaux Blanc, Bordeaux, France",0.75,Château le Grand Verdus,France,44.7943922,-0.3959235
"Château le Peyrat winery ,Castillon Côtes de Bordeaux, Bordeaux, France",0.6333333333333334,Château le Peyrat,France,44.837789,-0.57918
"Château les Peyroulets winery ,Bergerac, Southwest France, France",0.4166666666666667,Château les Peyroulets,France,44.853806,0.483392
"Château les Vieux Moulins winery ,Blaye Côtes de Bordeaux, Bordeaux, France",0.4183333333333333,Château les Vieux Moulins,France,45.21416199999999,-0.5519109999999999
"Clos Badon-Thunevin winery ,Saint-Émilion, Bordeaux, France",0.49444444444444446,Clos Badon-Thunevin,France,44.8951333,-0.1552201
"Clos des Menuts winery ,Bordeaux, Bordeaux, France",0.43333333333333335,Clos des Menuts,France,44.894754,-0.1549481
"Clos du Clocher winery ,Pomerol, Bordeaux, France",0.43333333333333335,Clos du Clocher,France,44.9298292,-0.2010233
"Collovray et Terrier winery ,Mâcon-Villages, Burgundy, France",0.43125,Collovray et Terrier,France,46.298989,4.755555999999999
"Collovray et Terrier winery ,Pouilly-Fuissé, Burgundy, France",0.41916666666666674,Collovray et Terrier,France,46.298989,4.755555999999999
"Cox winery ,Vin de Pays des Côtes de Gascogne, Southwest France, France",0.46904761904761905,Cox,France,,
"Côté Mas winery ,Pays d'Oc, Languedoc-Roussillon, France",0.45555555555555555,Côté Mas,France,43.488525,3.517566
"David Moreau winery ,Santenay, Burgundy, France",0.4215773809523809,David Moreau,France,46.914217,4.695831099999999
"Delmas winery ,Blanquette de Limoux, Languedoc-Roussillon, France",0.4145833333333333,Delmas,France,43.053289,2.218142
"Denis Père et Fils winery ,Savigny-lès-Beaune, Burgundy, France",0.42500000000000004,Denis Père et Fils,France,47.0836636,4.8489037
"Domaine A. Machard de Gramont winery ,Puligny-Montrachet, Burgundy, France",0.42666666666666675,Domaine A. Machard de Gramont,France,47.1078,4.9252862
"Domaine Alzitana winery ,Corse, France Other, France",0.4875,Domaine Alzitana,France,42.0396042,9.012892599999999
"Domaine Amirault winery ,Crémant de Loire, Loire Valley, France",0.4557792207792208,Domaine Amirault,France,47.2703169,-0.1046324
"Domaine Benoît & Mathieu Fleuriet winery ,Sancerre, Loire Valley, France",0.4225,Domaine Benoît & Mathieu Fleuriet,France,,
"Domaine Bernard Millot winery ,Bourgogne, Burgundy, France",0.4333333333333334,Domaine Bernard Millot,France,46.9740579,4.7705095
"Domaine Bernard Moreau et Fils winery ,Bourgogne, Burgundy, France",0.4166666666666667,Domaine Bernard Moreau et Fils,France,46.9363436,4.7324473
"Domaine Chanson winery ,Savigny-lès-Beaune, Burgundy, France",0.45555555555555555,Domaine Chanson,France,47.0450533,4.8436192
"Domaine Chantal Lescure winery ,Côte de Beaune, Burgundy, France",0.5199999999999999,Domaine Chantal Lescure,France,47.13548670000001,4.9493997
"Domaine Clos Gautier winery ,Côtes de Provence, Provence, France",0.48489583333333336,Domaine Clos Gautier,France,43.457215,6.164359
"Domaine Denis Jeandeau winery ,Pouilly-Fuissé, Burgundy, France",0.5,Domaine Denis Jeandeau,France,46.27985700000001,4.744308999999999
"Domaine Emmanuel Giboulot winery ,Beaune, Burgundy, France",0.54,Domaine Emmanuel Giboulot,France,47.0197136,4.846299399999999
"Domaine Faiveley winery ,Puligny-Montrachet, Burgundy, France",0.45238095238095233,Domaine Faiveley,France,46.9464158,4.7527797
"Domaine Grand St Paul winery ,Mediterranée, France Other, France",0.49659090909090914,Domaine Grand St Paul,France,44.4067519,4.3868135
"Domaine Jas d'Esclans winery ,Côtes de Provence, Provence, France",0.5604761904761906,Domaine Jas d'Esclans,France,43.521711,6.564198999999999
"Domaine Jean-Paul et Benoît Droin winery ,Petit Chablis, Burgundy, France",0.4183585858585859,Domaine Jean-Paul et Benoît Droin,France,47.8163223,3.8026625
"Domaine Jean-Philippe Fichet winery ,Bourgogne, Burgundy, France",0.44222222222222224,Domaine Jean-Philippe Fichet,France,46.97329,4.783526
"Domaine Jessiaume winery ,Burgundy, Burgundy, France",0.7,Domaine Jessiaume,France,46.9111604,4.701288
"Domaine Joël Delaunay winery ,nan, Loire Valley, France",0.5875,Domaine Joël Delaunay,France,47.30557169999999,1.2941935
"Domaine L. Chatelain winery ,Petit Chablis, Burgundy, France",0.41000000000000003,Domaine L. Chatelain,France,47.815269,3.800450999999999
"Domaine La Soufrandise winery ,Pouilly-Fuissé, Burgundy, France",0.48928571428571427,Domaine La Soufrandise,France,46.2815535,4.746282799999999
"Domaine Luquet winery ,Saint-Véran, Burgundy, France",0.425,Domaine Luquet,France,46.2801912,4.7434195
"Domaine Marc Jambon winery ,Mâcon-Pierreclos, Burgundy, France",0.45,Domaine Marc Jambon,France,46.322796,4.676229999999999
"Domaine Méo-Camuzet winery ,Chambolle-Musigny, Burgundy, France",0.4714285714285714,Domaine Méo-Camuzet,France,47.1603659,4.953246699999999
"Domaine Méo-Camuzet winery ,Corton-Charlemagne, Burgundy, France",0.4216666666666667,Domaine Méo-Camuzet,France,47.1603575,4.953254600000001
"Domaine Olivier Merlin winery ,Saint-Véran, Burgundy, France",0.44727272727272727,Domaine Olivier Merlin,France,47.0525047,4.3837215
"Domaine Paquet et Fils winery ,Pouilly-Fuissé, Burgundy, France",0.4083333333333334,Domaine Paquet et Fils,France,46.254981,4.780288
"Domaine Pascal et Mireille Renaud winery ,Saint-Véran, Burgundy, France",0.47000000000000003,Domaine Pascal et Mireille Renaud,France,44.700836,6.868570999999999
"Domaine Pignier winery ,Côtes du Jura, France Other, France",0.4483333333333333,Domaine Pignier,France,46.6602092,5.5648592
"Domaine René Bouvier winery ,Chambolle-Musigny, Burgundy, France",0.7,Domaine René Bouvier,France,47.180179,4.959953
"Domaine Rives-Blanques winery ,Pays d'Oc, Languedoc-Roussillon, France",0.4133333333333333,Domaine Rives-Blanques,France,43.1155509,2.2252893
"Domaine Rossignol-Trapet winery ,Bourgogne, Burgundy, France",0.4475,Domaine Rossignol-Trapet,France,47.226905,4.980850999999999
"Domaine Sophie Cinier winery ,Mâcon-Villages, Burgundy, France",0.46249999999999997,Domaine Sophie Cinier,France,46.2822193,4.748088399999999
"Domaine Val d'Astier winery ,Côtes de Provence, Provence, France",0.4139393939393939,Domaine Val d'Astier,France,43.2243608,6.5147132
"Domaine Vigneau-Chevreau winery ,Vouvray, Loire Valley, France",0.6814814814814815,Domaine Vigneau-Chevreau,France,47.4500781,0.8548585
"Domaine Vincent Girardin winery ,Mâcon-Fuissé, Burgundy, France",0.48,Domaine Vincent Girardin,France,46.9701337,4.7978282
"Domaine de Côtes Rémont winery ,Chénas, Beaujolais, France",0.5,Domaine de Côtes Rémont,France,46.219107,4.6818759
"Domaine de Laballe winery ,Landes, Southwest France, France",0.4965909090909091,Domaine de Laballe,France,43.9412045,-0.7532808999999999
"Domaine de Lamothe winery ,Côtes de Gascogne, Southwest France, France",0.4875,Domaine de Lamothe,France,44.0043016,1.8137221
"Domaine de Malavieille winery ,Coteaux du Languedoc, Languedoc-Roussillon, France",0.4083333333333334,Domaine de Malavieille,France,44.494959,3.313299
"Domaine de Montille winery ,Pommard, Burgundy, France",0.5071428571428571,Domaine de Montille,France,46.98256629999999,4.771274399999999
"Domaine de l'Amaurigue winery ,Côtes de Provence, Provence, France",0.4595887445887446,Domaine de l'Amaurigue,France,43.408159,6.298374300000001
"Domaine de la Coche winery ,Muscadet Côtes de Grandlieu, Loire Valley, France",0.8,Domaine de la Coche,France,47.115672,-1.820909
"Domaine de la Combe au Loup winery ,Régnié, Beaujolais, France",0.43000000000000005,Domaine de la Combe au Loup,France,46.1654786,4.6385438
"Domaine de la Croix Senaillet winery ,Pouilly-Fuissé, Burgundy, France",0.496875,Domaine de la Croix Senaillet,France,46.29963250000001,4.7524
"Domaine de la Denante winery ,Bourgogne, Burgundy, France",0.45,Domaine de la Denante,France,46.3026868,4.7556885
"Domaine de la Jobeline winery ,Mâcon-Villages, Burgundy, France",0.53,Domaine de la Jobeline,France,46.3706882,4.7301741
"Domaine de la Mordorée winery ,Vin de Pays du Gard, Rhône Valley, France",0.75,Domaine de la Mordorée,France,44.011567,4.705892
"Domaine de la Quilla winery ,Muscadet Sèvre et Maine, Loire Valley, France",0.4166666666666667,Domaine de la Quilla,France,47.5532402,1.0105289
"Domaine des Caves du Prieuré winery ,Sancerre, Loire Valley, France",0.42748299319727895,Domaine des Caves du Prieuré,France,47.3054689,2.7662513
"Domaine des Crets winery ,Mâcon-Chardonnay, Burgundy, France",0.5011904761904762,Domaine des Crets,France,47.0525047,4.3837215
"Domaine des Marrans winery ,Chiroubles, Beaujolais, France",0.4340909090909091,Domaine des Marrans,France,46.1768243,4.6927862
"Domaine des Mouilles winery ,Beaujolais-Villages, Beaujolais, France",0.5875,Domaine des Mouilles,France,46.0487118,4.6124838
