location,metric,winery,country,lat,lon
"A-Mano winery ,Puglia, Southern Italy, Italy",0.42954545454545456,A-Mano,Italy,40.7928393,17.1011931
"Agostino Bosco winery ,Barbera d'Alba, Piedmont, Italy",0.36500000000000005,Agostino Bosco,Italy,45.0522366,7.5153885
"Alberto Longo winery ,Cacc’e Mmitte di Lucera, Southern Italy, Italy",0.3666666666666667,Alberto Longo,Italy,41.5157722,15.2849966
"Allegrini winery ,Valpolicella Classico, Veneto, Italy",0.4150252525252525,Allegrini,Italy,45.5399578,10.8768265
"Altadonna winery ,Toscana, Tuscany, Italy",0.35277777777777786,Altadonna,Italy,43.61238480000001,11.1915646
"Altanuta winery ,Valdadige, Veneto, Italy",0.38571428571428573,Altanuta,Italy,45.4414662,12.3152595
"Andrea Felici winery ,Verdicchio dei Castelli di Jesi Classico, Central Italy, Italy",0.3958333333333333,Andrea Felici,Italy,43.41341449999999,13.1081969
"Andrero winery ,Terre Siciliane, Sicily & Sardinia, Italy",0.4000000000000001,Andrero,Italy,37.5999938,14.0153557
"Anna Maria Abbona winery ,Dolcetto di Dogliani Superiore, Piedmont, Italy",0.4107142857142857,Anna Maria Abbona,Italy,44.4870929,7.9569188
"Anna Spinato winery ,Prosecco Treviso, Veneto, Italy",0.3666666666666667,Anna Spinato,Italy,45.7195796,12.4577004
"Anselmi winery ,Delle Venezie, Northeastern Italy, Italy",0.3541666666666667,Anselmi,Italy,45.61030479999999,11.1425311
"Antica Casa Vinicola Scarpa winery ,Barbera d'Asti, Piedmont, Italy",0.3861111111111111,Antica Casa Vinicola Scarpa,Italy,44.7711947,8.3508356
"Antichi Vigneti di Cantalupo winery ,Colline Novaresi, Piedmont, Italy",0.4375000000000001,Antichi Vigneti di Cantalupo,Italy,45.6004209,8.4262261
"Antinori winery ,Toscana, Tuscany, Italy",0.45,Antinori,Italy,43.61238480000001,11.1915646
"Araldica winery ,Gavi, Piedmont, Italy",0.575,Araldica,Italy,44.7211309,8.3832214
"Arbiola winery ,Barbera d'Asti, Piedmont, Italy",0.48,Arbiola,Italy,44.7675432,8.302966999999999
"Astoria winery ,Delle Venezie, Northeastern Italy, Italy",0.39333333333333337,Astoria,Italy,45.8705179,12.253428
"Attilio Ghisolfi winery ,Barbera d'Alba, Piedmont, Italy",0.4916666666666667,Attilio Ghisolfi,Italy,44.5980966,7.966176600000001
"Azienda Agricola Cogno winery ,Dolcetto d'Alba, Piedmont, Italy",0.4583333333333333,Azienda Agricola Cogno,Italy,44.7009153,8.0356911
"Banfi winery ,Italy, Italy Other, Italy",0.42333333333333334,Banfi,Italy,42.980621,11.400659
"Baron di Pauli winery ,Vigneti delle Dolomiti, Northeastern Italy, Italy",0.36250000000000004,Baron di Pauli,Italy,46.420953,11.2520763
"Barone di Villagrande winery ,Sicilia, Sicily & Sardinia, Italy",0.688888888888889,Barone di Villagrande,Italy,37.7138593,15.1191485
"Bava winery ,nan, Piedmont, Italy",0.54,Bava,Italy,45.0846961,8.068000999999999
"Bellini winery ,Toscana, Tuscany, Italy",0.42500000000000004,Bellini,Italy,43.77190400000001,11.508695
"Belpoggio winery ,Rosso di Montalcino, Tuscany, Italy",0.48,Belpoggio,Italy,42.9901081,11.5287652
"Benincasa winery ,Montefalco Rosso, Central Italy, Italy",0.38749999999999996,Benincasa,Italy,42.88929359999999,12.6502843
"Benito Ferrara winery ,Fiano di Avellino, Southern Italy, Italy",0.39666666666666667,Benito Ferrara,Italy,41.019526,14.822301
"Bernardis winery ,Friuli, Northeastern Italy, Italy",0.4875,Bernardis,Italy,46.03091,13.4789053
"Bertani winery ,Valpolicella Classico Superiore Ripasso, Veneto, Italy",0.37142857142857144,Bertani,Italy,45.50335099999999,10.9470875
"Bertani winery ,Valpolicella Classico, Veneto, Italy",0.3770833333333333,Bertani,Italy,45.50335099999999,10.9470875
"Bisol winery ,Prosecco di Valdobbiadene, Veneto, Italy",0.43443181818181814,Bisol,Italy,45.8998453,12.0401104
"Bivio winery ,Delle Venezie, Northeastern Italy, Italy",0.36,Bivio,Italy,45.5657302,11.2818593
"Bollini winery ,Collio, Northeastern Italy, Italy",0.385,Bollini,Italy,45.8109034,10.3338726
"Borgo Isolabella winery ,Loazzolo, Piedmont, Italy",0.4535714285714286,Borgo Isolabella,Italy,44.6785102,8.2710743
"Borgo Magredo winery ,Friuli Grave, Northeastern Italy, Italy",0.75,Borgo Magredo,Italy,46.095699,12.846102
"Borgo di Colloredo winery ,Falanghina del Molise, Southern Italy, Italy",0.4,Borgo di Colloredo,Italy,41.8874809,15.0759153
"Borgogno F.lli Serio e Battista winery ,Barbera d'Alba Superiore, Piedmont, Italy",0.37395833333333334,Borgogno F.lli Serio e Battista,Italy,44.6193142,7.948184599999999
"Boroli winery ,Barbera d'Alba, Piedmont, Italy",0.4072222222222222,Boroli,Italy,44.6224149,7.9674617
"Bortolomiol winery ,Prosecco di Valdobbiadene Superiore, Veneto, Italy",0.3999621212121212,Bortolomiol,Italy,45.8978165,11.9850305
"Bortolomiol winery ,Valdobbiadene Superiore di Cartizze, Veneto, Italy",0.46428571428571436,Bortolomiol,Italy,45.88263750000001,12.0041008
"Bortolotti winery ,Valdobbiadene Superiore di Cartizze, Veneto, Italy",0.38208333333333333,Bortolotti,Italy,45.9000276,12.0017983
"Bosio winery ,Moscato d'Asti, Piedmont, Italy",0.35214646464646465,Bosio,Italy,45.0522366,7.5153885
"Bricco dei Guazzi winery ,Barbera del Monferrato, Piedmont, Italy",0.3803125,Bricco dei Guazzi,Italy,45.0384846,8.3664987
"Bricco dei Guazzi winery ,Gavi di Gavi, Piedmont, Italy",0.6008333333333333,Bricco dei Guazzi,Italy,44.6880915,8.8037472
"Brjnda winery ,Nebbiolo d'Alba, Piedmont, Italy",0.4952380952380952,Brjnda,Italy,44.6766462,8.0652309
"Bruno Giacosa winery ,Nebbiolo d'Alba, Piedmont, Italy",0.5777777777777778,Bruno Giacosa,Italy,44.7009153,8.0356911
"Ca'Tullio winery ,Colli Orientali del Friuli, Northeastern Italy, Italy",0.48,Ca'Tullio,Italy,45.7639273,13.3711269
"Ca'Tullio winery ,Friuli Aquileia, Northeastern Italy, Italy",0.45555555555555555,Ca'Tullio,Italy,45.7639273,13.3711269
"Caldora Vini winery ,Montepulciano d'Abruzzo, Central Italy, Italy",0.37278311965811967,Caldora Vini,Italy,42.3329197,14.3908447
"Campanile winery ,Delle Venezie, Northeastern Italy, Italy",0.4222222222222222,Campanile,Italy,45.4462202,10.6679844
"Campo alle Comete winery ,Bolgheri, Tuscany, Italy",0.4666666666666666,Campo alle Comete,Italy,43.173044,10.604627
"Campomaggio winery ,Toscana, Tuscany, Italy",0.43333333333333335,Campomaggio,Italy,43.481859,11.231955
"Candido winery ,Salice Salentino, Southern Italy, Italy",0.3527777777777778,Candido,Italy,40.385073,17.9652521
"Cantarutti winery ,Colli Orientali del Friuli, Northeastern Italy, Italy",0.3966269841269841,Cantarutti,Italy,46.0487619,13.3864489
"Canti winery ,Prosecco, Veneto, Italy",0.42000000000000004,Canti,Italy,45.4414662,12.3152595
"Cantina Alice Bel Colle winery ,Barbera d'Asti, Piedmont, Italy",0.4133333333333334,Cantina Alice Bel Colle,Italy,44.7246625,8.4394949
"Cantina Nalles Magre winery ,Alto Adige, Northeastern Italy, Italy",0.7000000000000001,Cantina Nalles Magre,Italy,46.5388341,11.2039337
"Cantina dei Produttori Nebbiolo di Carema winery ,Carema, Piedmont, Italy",0.42500000000000004,Cantina dei Produttori Nebbiolo di Carema,Italy,45.5822113,7.8083161
"Cantine Aurora winery ,Barbera d'Asti Superiore, Piedmont, Italy",0.3666666666666667,Cantine Aurora,Italy,44.46021469999999,7.103975999999999
"Cantine Bellini winery ,Toscana, Tuscany, Italy",0.3875,Cantine Bellini,Italy,43.77190400000001,11.508695
"Cantine Florio winery ,Malvasia delle Lipari, Sicily & Sardinia, Italy",0.38250000000000006,Cantine Florio,Italy,37.5999938,14.0153557
"Cantine Lenotti di Lenotti winery ,Soave Classico, Veneto, Italy",0.43333333333333335,Cantine Lenotti di Lenotti,Italy,45.5441949,10.7248046
"Cantine Volpi winery ,Veneto, Veneto, Italy",0.4138888888888889,Cantine Volpi,Italy,45.2820611,11.6816352
"Capannelle winery ,Toscana, Tuscany, Italy",0.36849999999999994,Capannelle,Italy,43.4739388,11.4348378
"Caparzo winery ,Maremma, Tuscany, Italy",0.43714285714285717,Caparzo,Italy,43.0960287,11.502132
"Caparzo winery ,Morellino di Scansano, Tuscany, Italy",0.7166666666666667,Caparzo,Italy,42.6863861,11.3339204
"Capocroce winery ,Sicilia, Sicily & Sardinia, Italy",0.5333333333333333,Capocroce,Italy,37.6801234,13.1958688
"Caposaldo winery ,Pavia, Lombardy, Italy",0.42333333333333334,Caposaldo,Italy,45.1847248,9.1582069
"Casa Girelli winery ,Montepulciano d'Abruzzo, Central Italy, Italy",0.44000000000000006,Casa Girelli,Italy,46.0484756,11.1299263
"Cascina Bruciata winery ,Langhe, Piedmont, Italy",0.3666666666666667,Cascina Bruciata,Italy,44.7276382,8.1157322
"Cascina Guido Berta winery ,Barbera d'Asti Superiore Nizza, Piedmont, Italy",0.4058333333333333,Cascina Guido Berta,Italy,44.7694339,8.3029808
"Cascina Roera winery ,Barbera d'Asti Superiore, Piedmont, Italy",0.38,Cascina Roera,Italy,44.7604373,8.209913
"Cascina delle Rose winery ,Langhe, Piedmont, Italy",0.36483333333333334,Cascina delle Rose,Italy,44.70591049999999,8.0829872
"Casebianche winery ,Vino Spumante, Italy Other, Italy",0.3666666666666667,Casebianche,Italy,40.3252576,15.0174718
"Casisano Colombaio winery ,Rosso di Montalcino, Tuscany, Italy",0.4,Casisano Colombaio,Italy,43.0084228,11.4961481
"Castellare winery ,Colli della Toscana Centrale, Tuscany, Italy",0.41809523809523813,Castellare,Italy,44.0794258,10.3311955
"Castellargo winery ,Friuli Grave, Northeastern Italy, Italy",0.3833333333333333,Castellargo,Italy,45.8950312,12.5991658
"Castellarin winery ,Delle Venezie, Northeastern Italy, Italy",0.5111111111111111,Castellarin,Italy,45.92950219999999,11.5621417
"Castello Monaci winery ,Salice Salentino, Southern Italy, Italy",0.36770833333333336,Castello Monaci,Italy,40.3888072,17.8795013
"Castello Romitorio winery ,Sant'Antimo, Tuscany, Italy",0.3616666666666667,Castello Romitorio,Italy,43.055452,11.449105
"Castello del Poggio winery ,Asti, Piedmont, Italy",0.3701388888888889,Castello del Poggio,Italy,44.9785333,8.2530682
"Castello di Montegiove winery ,Orvieto, Central Italy, Italy",0.38518518518518513,Castello di Montegiove,Italy,42.9174691,12.1435214
"Castello di Neive winery ,Barbera d'Alba, Piedmont, Italy",0.44761904761904764,Castello di Neive,Italy,44.7009153,8.0356911
"Castello di Nipozzano winery ,Toscana, Tuscany, Italy",0.4633333333333334,Castello di Nipozzano,Italy,43.785386,11.469571
"Castello di Uviglie winery ,Barbera del Monferrato Superiore, Piedmont, Italy",0.4441666666666667,Castello di Uviglie,Italy,45.07501000000001,8.409788200000001
"Cavit winery ,Teroldego Rotaliano, Northeastern Italy, Italy",0.35833333333333334,Cavit,Italy,46.2064495,11.1000317
"Cerbaiona winery ,Brunello di Montalcino, Tuscany, Italy",0.4406060606060606,Cerbaiona,Italy,43.0419448,11.5255422
"Ceretto winery ,Dolcetto d'Alba, Piedmont, Italy",0.38636363636363635,Ceretto,Italy,44.6722487,7.996287499999999
"Cescon Italo Storia e Vini winery ,Friuli Grave, Northeastern Italy, Italy",0.47500000000000003,Cescon Italo Storia e Vini,Italy,45.7572351,12.4127913
"Cielo e Terra winery ,Delle Venezie, Northeastern Italy, Italy",0.35793650793650794,Cielo e Terra,Italy,45.92950219999999,11.5621417
"Cielo e Terra winery ,Puglia, Southern Italy, Italy",0.41111111111111115,Cielo e Terra,Italy,40.7928393,17.1011931
"Col d'Orcia winery ,Toscana, Tuscany, Italy",0.38888888888888884,Col d'Orcia,Italy,42.967171,11.437808
"Collevite winery ,Falerio, Central Italy, Italy",0.43333333333333335,Collevite,Italy,42.9168402,13.7862665
"Colli Ripani winery ,Offida Pecorino, Central Italy, Italy",0.4,Colli Ripani,Italy,42.9408629,13.6965046
"Colli di Lapio winery ,Taurasi, Southern Italy, Italy",0.39166666666666666,Colli di Lapio,Italy,40.9712593,14.9248429
"Colonnara winery ,Verdicchio dei Castelli di Jesi, Central Italy, Italy",0.47388888888888897,Colonnara,Italy,43.4528359,13.1064769
"Conte Collalto winery ,Conegliano Valdobbiadene Prosecco Superiore, Veneto, Italy",0.37872023809523814,Conte Collalto,Italy,45.4414662,12.3152595
"Cornarea winery ,Roero Arneis, Piedmont, Italy",0.7,Cornarea,Italy,44.757222,8.0062186
"Corte Lenguin winery ,Valpolicella Classico Superiore Ripasso, Veneto, Italy",0.42291666666666666,Corte Lenguin,Italy,45.5107107,10.908257
"Costaripa winery ,Garda Classico, Northeastern Italy, Italy",0.3666666666666667,Costaripa,Italy,45.543052,10.735917
"Cà Furlan winery ,Prosecco, Veneto, Italy",0.358,Cà Furlan,Italy,45.4414662,12.3152595
"Cà ed Balos winery ,Moscato d'Asti, Piedmont, Italy",0.3666666666666667,Cà ed Balos,Italy,44.8007825,8.2524002
"Dalfiume winery ,Emilia-Romagna, Central Italy, Italy",0.46562499999999996,Dalfiume,Italy,44.5967607,11.2186396
"De Faveri winery ,Valdobbiadene Superiore di Cartizze, Veneto, Italy",0.42000000000000004,De Faveri,Italy,45.8604316,12.0648641
"Demarie winery ,Barbera d'Alba Superiore, Piedmont, Italy",0.45666666666666667,Demarie,Italy,44.764393,8.018837
"Dessilani winery ,Fara, Piedmont, Italy",0.37777777777777777,Dessilani,Italy,45.5499512,8.4661739
"Di Filippo winery ,Umbria, Central Italy, Italy",0.495,Di Filippo,Italy,42.98889,12.551121
"Di Lenardo winery ,Friuli Grave, Northeastern Italy, Italy",0.38833333333333336,Di Lenardo,Italy,45.8997375,13.2750013
"Di Majo Norante winery ,Biferno Rosso, Southern Italy, Italy",0.5375,Di Majo Norante,Italy,41.9110781,15.099341
"Dogliotti 1870 winery ,Barbera d'Asti, Piedmont, Italy",0.4,Dogliotti 1870,Italy,44.7476938,8.148816199999999
"Domenico Cavazza winery ,Prosecco, Veneto, Italy",0.3583333333333334,Domenico Cavazza,Italy,45.46529719999999,11.3613854
"Domenico Fraccaroli winery ,Amarone della Valpolicella, Veneto, Italy",0.3753968253968254,Domenico Fraccaroli,Italy,45.506562,10.915152
"Domenico de Bertiol winery ,Prosecco di Conegliano, Veneto, Italy",0.4181818181818182,Domenico de Bertiol,Italy,45.889197,12.3006368
"Duchessa Lia winery ,Barbera d'Asti, Piedmont, Italy",0.63,Duchessa Lia,Italy,44.90075119999999,8.2064257
"E. Pira e Figli (Chiara Boschis) winery ,Dolcetto d'Alba, Piedmont, Italy",0.43404761904761907,E. Pira e Figli (Chiara Boschis),Italy,44.610032,7.940128
"El Vegro winery ,Soave Classico, Veneto, Italy",0.5,El Vegro,Italy,45.4228928,11.2992038
"Endrizzi winery ,Trento, Northeastern Italy, Italy",0.4000000000000001,Endrizzi,Italy,46.20462089999999,11.1433704
"Enza winery ,Prosecco, Veneto, Italy",0.48333333333333334,Enza,Italy,45.4414662,12.3152595
"Eredi Lodali winery ,Barbaresco, Piedmont, Italy",0.3642857142857144,Eredi Lodali,Italy,44.689298,8.0871292
"Fabiano winery ,Recioto della Valpolicella, Veneto, Italy",0.37,Fabiano,Italy,45.4813442,10.9075725
"Falesco winery ,Assisi, Central Italy, Italy",0.5166666666666667,Falesco,Italy,42.65204079999999,12.2443794
"Farina winery ,Valpolicella Classico Superiore Ripasso, Veneto, Italy",0.3513888888888889,Farina,Italy,45.5205517,10.8869911
"Fattoria Poggio Capponi winery ,Toscana, Tuscany, Italy",0.45,Fattoria Poggio Capponi,Italy,43.6920069,11.049801
"Fattoria San Francesco winery ,Cirò, Southern Italy, Italy",0.4329166666666667,Fattoria San Francesco,Italy,39.388845,17.078547
"Fattoria San Michele a Torri winery ,Chianti Colli Fiorentini, Tuscany, Italy",0.6,Fattoria San Michele a Torri,Italy,43.7015596,11.1293579
"Fattoria Sorbaiano winery ,Toscana, Tuscany, Italy",0.42142857142857143,Fattoria Sorbaiano,Italy,43.382856,10.738932
"Ferrari Iris e Figli winery ,Bolgheri Superiore, Tuscany, Italy",0.5,Ferrari Iris e Figli,Italy,43.2808121,10.5458727
"Feudo Maccari winery ,Moscato di Noto, Sicily & Sardinia, Italy",0.3821428571428571,Feudo Maccari,Italy,36.8924433,15.0651945
"Feudo Solaria winery ,Mamertino, Sicily & Sardinia, Italy",0.39166666666666666,Feudo Solaria,Italy,38.2126542,15.2403092
"Fontanabianca winery ,Barbera d'Alba, Piedmont, Italy",0.3983333333333334,Fontanabianca,Italy,44.7348965,8.1105479
"Fratelli Casetta winery ,Barbera d'Alba, Piedmont, Italy",0.5275000000000001,Fratelli Casetta,Italy,44.7632956,8.0105678
"Fratta Pasini winery ,Valpolicella Classico, Veneto, Italy",0.5416666666666667,Fratta Pasini,Italy,45.5398173,10.8824731
"Geretto winery ,Delle Venezie, Northeastern Italy, Italy",0.39166666666666666,Geretto,Italy,45.92950219999999,11.5621417
"Giacomo Ascheri winery ,Gavi di Gavi, Piedmont, Italy",0.5069444444444444,Giacomo Ascheri,Italy,44.692088,7.8478
"Giacomo Vico winery ,Barolo, Piedmont, Italy",0.46249999999999997,Giacomo Vico,Italy,44.7983213,7.987604699999999
"Gini winery ,Delle Venezie, Northeastern Italy, Italy",0.42000000000000004,Gini,Italy,45.4207313,11.2818017
"Gini winery ,Recioto di Soave, Veneto, Italy",0.39375,Gini,Italy,45.4414662,12.3152595
"Giordano winery ,Barolo, Piedmont, Italy",0.4166666666666667,Giordano,Italy,44.64131039999999,8.0001663
"Giorgio Meletti Cavallari winery ,Bolgheri Superiore, Tuscany, Italy",0.39875000000000005,Giorgio Meletti Cavallari,Italy,43.1675501,10.5826631
"Giribaldi winery ,Nebbiolo d'Alba, Piedmont, Italy",0.4226190476190476,Giribaldi,Italy,44.6306089,8.056634899999999
"Giulio Ferrari winery ,Trento, Northeastern Italy, Italy",0.3942857142857143,Giulio Ferrari,Italy,46.04414329999999,11.1135902
"Goretti winery ,Colli Perugini, Central Italy, Italy",0.375,Goretti,Italy,43.05003500000001,12.3513541
"Il Conte d'Alba winery ,Piedmont, Piedmont, Italy",0.40166666666666667,Il Conte d'Alba,Italy,44.7009153,8.0356911
"Inalto winery ,Delle Venezie, Northeastern Italy, Italy",0.4066666666666666,Inalto,Italy,45.92950219999999,11.5621417
"Josef Niedermayr winery ,Alto Adige, Northeastern Italy, Italy",0.40249999999999997,Josef Niedermayr,Italy,46.4629816,11.2832047
"La Battistina winery ,Gavi, Piedmont, Italy",0.36666666666666664,La Battistina,Italy,44.7225642,8.7981123
"La Casa Dell'Orco winery ,Beneventano, Southern Italy, Italy",0.3583333333333333,La Casa Dell'Orco,Italy,41.2035093,14.7520939
"La Colombaia winery ,Chianti Colli Fiorentini, Tuscany, Italy",0.41111111111111115,La Colombaia,Italy,43.21696420000001,10.8980744
"La Francesca winery ,Veneto, Veneto, Italy",0.4,La Francesca,Italy,45.2301681,11.7432092
"La Gioiosa winery ,Valdobbiadene Prosecco Superiore, Veneto, Italy",0.43333333333333335,La Gioiosa,Italy,45.9000276,12.0017983
"La Mancina winery ,Colli Bolognesi, Central Italy, Italy",0.45,La Mancina,Italy,44.4866767,11.0655458
"La Marca winery ,Prosecco, Veneto, Italy",0.35416666666666663,La Marca,Italy,45.807568,12.497794
"La Marcellina winery ,Chianti Classico, Tuscany, Italy",0.39285714285714285,La Marcellina,Italy,43.5510053,11.3099527
"La Piasola winery ,Gavi, Piedmont, Italy",0.38055555555555554,La Piasola,Italy,44.6880915,8.8037472
"La Sala winery ,Chianti Classico, Tuscany, Italy",0.386969696969697,La Sala,Italy,43.654869,11.15771
"La Selva winery ,Maremma, Tuscany, Italy",0.7250000000000001,La Selva,Italy,42.9905655,10.9976453
"La Staffa winery ,Verdicchio dei Castelli di Jesi Classico, Central Italy, Italy",0.37500000000000006,La Staffa,Italy,,
"La Tordera winery ,Prosecco di Conegliano e Valdobbiadene, Veneto, Italy",0.36944444444444446,La Tordera,Italy,45.863342,12.051261
"La Tordera winery ,Veneto, Veneto, Italy",0.5,La Tordera,Italy,45.863342,12.051261
"La Traiana winery ,Chianti Superiore, Tuscany, Italy",0.375,La Traiana,Italy,43.5527664,11.6714305
"La Valentina winery ,Montepulciano d'Abruzzo Cerasuolo, Central Italy, Italy",0.43523809523809526,La Valentina,Italy,42.426243,14.1320558
"LaLuca winery ,Prosecco Treviso, Veneto, Italy",0.4,LaLuca,Italy,45.6668893,12.2430437
"Lamberti winery ,Veneto, Veneto, Italy",0.4833333333333334,Lamberti,Italy,45.4414662,12.3152595
"Lamborghini winery ,Umbria, Central Italy, Italy",0.42159722222222223,Lamborghini,Italy,42.938004,12.6216211
"Le Cinciole winery ,Chianti Classico, Tuscany, Italy",0.36250000000000004,Le Cinciole,Italy,43.5578758,11.30081
"Le Corti dei Farfensi winery ,Falerio, Central Italy, Italy",0.36250000000000004,Le Corti dei Farfensi,Italy,43.1597099,13.721132
"Le Due Terre winery ,Colli Orientali del Friuli, Northeastern Italy, Italy",0.36666666666666664,Le Due Terre,Italy,46.03962809999999,13.4780574
"Le Rose winery ,Lazio, Central Italy, Italy",0.39642857142857146,Le Rose,Italy,41.6552418,12.989615
"Le Solive winery ,Vernaccia di San Gimignano, Tuscany, Italy",0.38273809523809527,Le Solive,Italy,43.4676324,11.0434909
"Le Vigne di Alice winery ,Conegliano Valdobbiadene Prosecco Superiore, Veneto, Italy",0.4071428571428571,Le Vigne di Alice,Italy,45.9515704,12.2892433
"Les Crêtes winery ,Valle d'Aosta, Northwestern Italy, Italy",0.35714285714285715,Les Crêtes,Italy,45.7046096,7.247539299999999
"Loacker Corte Pavone winery ,Brunello di Montalcino, Tuscany, Italy",0.64,Loacker Corte Pavone,Italy,43.0523493,11.452567
"Luciana Cordioli winery ,Valpolicella Classico Superiore Ripasso, Veneto, Italy",0.39305555555555555,Luciana Cordioli,Italy,45.5205517,10.8869911
"Maccari Spumanti winery ,Prosecco di Conegliano e Valdobbiadene, Veneto, Italy",0.39444444444444443,Maccari Spumanti,Italy,45.8936579,12.327958
"Marchese dell'Elsa winery ,Moscato d'Asti, Piedmont, Italy",0.39999999999999997,Marchese dell'Elsa,Italy,45.0522366,7.5153885
"Marchesi Torrigiani winery ,Chianti, Tuscany, Italy",0.3666666666666667,Marchesi Torrigiani,Italy,43.4356356,11.3024047
"Marchesi de' Frescobaldi winery ,Rosso di Montalcino, Tuscany, Italy",0.37121212121212127,Marchesi de' Frescobaldi,Italy,43.0391804,11.4074409
"Marco Felluga winery ,Delle Venezie, Northeastern Italy, Italy",0.38,Marco Felluga,Italy,45.9568766,13.5158332
"Marilena Barbera winery ,Menfi, Sicily & Sardinia, Italy",0.371875,Marilena Barbera,Italy,37.5901749,12.9352565
"Martini & Rossi winery ,Italy, Italy Other, Italy",0.35833333333333334,Martini & Rossi,Italy,37.6877747,-97.32661829999999
"Martini & Rossi winery ,Moscato d'Asti, Piedmont, Italy",0.4066666666666667,Martini & Rossi,Italy,37.6877747,-97.32661829999999
"Marziano Abbona winery ,Barbera d'Alba, Piedmont, Italy",0.3550925925925926,Marziano Abbona,Italy,44.552969,7.951918999999999
"Massolino winery ,Dolcetto d'Alba, Piedmont, Italy",0.44666666666666666,Massolino,Italy,44.60982389999999,7.9997527
"Mauro Sebaste winery ,Nebbiolo d'Alba, Piedmont, Italy",0.38055555555555554,Mauro Sebaste,Italy,44.6493296,7.978653899999999
"Mauro Veglio winery ,Barbera d'Alba, Piedmont, Italy",0.375,Mauro Veglio,Italy,44.6398139,7.9482841
"Meroi winery ,Colli Orientali del Friuli, Northeastern Italy, Italy",0.3576785714285714,Meroi,Italy,46.0154165,13.3325099
"Milziade Antano winery ,Sagrantino di Montefalco, Central Italy, Italy",0.365625,Milziade Antano,Italy,42.9178331,12.6172919
"Mionetto winery ,Prosecco di Conegliano e Valdobbiadene, Veneto, Italy",0.39999999999999997,Mionetto,Italy,45.8973831,11.9892827
"Moletto winery ,Piave, Veneto, Italy",0.45461309523809523,Moletto,Italy,45.7896521,12.5920639
"Moletto winery ,Prosecco del Veneto, Veneto, Italy",0.375,Moletto,Italy,45.7836794,12.5760254
"Montaribaldi winery ,Moscato d'Asti, Piedmont, Italy",0.3875,Montaribaldi,Italy,44.704259,8.076571
"Montaribaldi winery ,Roero, Piedmont, Italy",0.575,Montaribaldi,Italy,44.704259,8.076571
"Monte Tondo winery ,Amarone della Valpolicella, Veneto, Italy",0.45,Monte Tondo,Italy,45.4103833,11.2579395
"Monte Tondo winery ,Valpolicella Ripasso, Veneto, Italy",0.5833333333333334,Monte Tondo,Italy,45.4103833,11.2579395
"Monte del Frà winery ,Valpolicella Classico Superiore Ripasso, Veneto, Italy",0.3533333333333334,Monte del Frà,Italy,45.388789,10.825568
"Monte del Frá winery ,Custoza Superiore, Veneto, Italy",0.4222222222222222,Monte del Frá,Italy,45.388789,10.825568
"Montresor winery ,Bianco di Custoza, Veneto, Italy",0.65,Montresor,Italy,45.3729347,10.7962865
"Moretti Omero winery ,Sagrantino di Montefalco, Central Italy, Italy",0.5,Moretti Omero,Italy,42.8515581,12.580707
"Motta winery ,Bolgheri, Tuscany, Italy",0.3666666666666667,Motta,Italy,43.15984330000001,10.601076
"Nicolis winery ,Valpolicella Classico Superiore, Veneto, Italy",0.375,Nicolis,Italy,45.5272,10.88378
"Nino Franco winery ,Prosecco Superiore di Cartizze, Veneto, Italy",0.415625,Nino Franco,Italy,45.8973734,11.9908643
"Orion Wine winery ,Sicilia, Sicily & Sardinia, Italy",0.5,Orion Wine,Italy,37.5999938,14.0153557
"Ottella winery ,Lugana Superiore, Lombardy, Italy",0.35624999999999996,Ottella,Italy,45.47906709999999,9.8452433
"Paladin winery ,Prosecco, Veneto, Italy",0.43333333333333335,Paladin,Italy,45.7899024,12.6642952
"Paolo Calì winery ,Cerasuolo di Vittoria, Sicily & Sardinia, Italy",0.43,Paolo Calì,Italy,36.981787,14.549543
"Pasetti winery ,Trebbiano d'Abruzzo, Central Italy, Italy",0.39666666666666667,Pasetti,Italy,42.441456,14.24926
"Peter Zemmer winery ,Vigneti delle Dolomiti, Northeastern Italy, Italy",0.40699404761904756,Peter Zemmer,Italy,46.2678292,11.2244039
"Pieropan winery ,Soave Classico Superiore, Veneto, Italy",0.35275297619047624,Pieropan,Italy,45.4223008,11.2485921
"Pietracupa winery ,Fiano di Avellino, Southern Italy, Italy",0.475,Pietracupa,Italy,40.96111,14.81052
"Pietraventosa winery ,Murgia, Southern Italy, Italy",0.47500000000000003,Pietraventosa,Italy,40.800597,16.885186
"Pietro Rinaldi winery ,Dolcetto d'Alba, Piedmont, Italy",0.4866666666666667,Pietro Rinaldi,Italy,44.6766462,8.0652309
"Pio Cesare winery ,Cortese di Gavi, Piedmont, Italy",0.375,Pio Cesare,Italy,44.6880915,8.8037472
"Plozner winery ,Prosecco, Veneto, Italy",0.3666666666666667,Plozner,Italy,45.4414662,12.3152595
"Podere dei Brichhi Astigiani winery ,Barbera d'Asti, Piedmont, Italy",0.42500000000000004,Podere dei Brichhi Astigiani,Italy,44.8224393,8.190754
"Poderi San Lazzaro winery ,Offida Pecorino, Central Italy, Italy",0.4,Poderi San Lazzaro,Italy,42.9247748,13.7237448
"Poggio Verrano winery ,Maremma, Tuscany, Italy",0.36428571428571427,Poggio Verrano,Italy,42.6592952,11.2511292
"Poliziano winery ,Toscana, Tuscany, Italy",0.3792857142857143,Poliziano,Italy,43.1347754,11.8444305
"Ponchione Maurizio winery ,Barbera d'Alba, Piedmont, Italy",0.37500000000000006,Ponchione Maurizio,Italy,44.807621,8.104963
"Pozzi winery ,Delle Venezie, Northeastern Italy, Italy",0.37222222222222223,Pozzi,Italy,45.34692949999999,10.7598935
"Principe Corsini Fattoria Le Corti winery ,Maremma Toscana, Tuscany, Italy",0.6486111111111111,Principe Corsini Fattoria Le Corti,Italy,42.5413813,11.3504274
